number,description,createdAt,updatedAt
253,"This Pokémon adeptly flies from branch to branch in trees.
In a forest, no Pokémon can ever hope to catch a fleeing
Grovyle however fast they may be.","2018-07-18 03:50:39","2018-07-18 03:50:39"
254,"Sceptile has seeds growing on its back. They are said to be
bursting with nutrients that revitalize trees. This Pokémon
raises the trees in a forest with loving care.","2018-07-18 03:16:13","2018-07-18 03:16:13"
255,"Torchic has a place inside its body where it keeps its flame.
Give it a hug—it will be glowing with warmth. This Pokémon is
covered all over by a fluffy coat of down.","2018-07-18 03:50:36","2018-07-18 03:50:36"
256,"Combusken battles with the intensely hot flames it spews from
its beak and with outstandingly destructive kicks. This
Pokémon’s cry is very loud and distracting.","2018-07-18 03:02:40","2018-07-18 03:02:40"
257,"Blaziken has incredibly strong legs—it can easily clear a
30-story building in one leap. This Pokémon’s blazing punches
leave its foes scorched and blackened.","2018-07-18 04:08:19","2018-07-18 04:08:19"
258,"In water, Mudkip breathes using the gills on its cheeks. If it is
faced with a tight situation in battle, this Pokémon will unleash
its amazing power—it can crush rocks bigger than itself.","2018-07-18 02:57:40","2018-07-18 02:57:40"
259,"Marshtomp is much faster at traveling through mud than it is at
swimming. This Pokémon’s hindquarters exhibit obvious
development, giving it the ability to walk on just its hind legs.","2018-07-18 03:49:48","2018-07-18 03:49:48"
260,"Swampert predicts storms by sensing subtle differences in the
sounds of waves and tidal winds with its fins. If a storm is
approaching, it piles up boulders to protect itself.","2018-07-18 03:50:52","2018-07-18 03:50:52"
261,"Poochyena is an omnivore—it will eat anything. A distinguishing
feature is how large its fangs are compared to its body. This
Pokémon tries to intimidate its foes by making the hair on its
tail bristle out.","2018-07-18 04:08:44","2018-07-18 04:08:44"
262,"Mightyena travel and act as a pack in the wild. The memory
of its life in the wild compels the Pokémon to obey only
those Trainers that it recognizes to possess superior skill.","2018-07-18 03:51:07","2018-07-18 03:51:07"
263,"The hair on Zigzagoon’s back is bristly. It rubs the hard back
hair against trees to leave its territorial markings. This Pokémon
may play dead to fool foes in battle.","2018-07-18 02:57:19","2018-07-18 02:57:19"
264,"When hunting, Linoone will make a beeline straight for the
prey at a full run. While this Pokémon is capable of topping
60 mph, it has to come to a screeching halt before it can turn.","2018-07-18 03:49:56","2018-07-18 03:49:56"
265,"Wurmple is targeted by Swellow as prey. This Pokémon
will try to resist by pointing the spikes on its rear at the
attacking predator. It will weaken the foe by leaking poison
from the spikes.","2018-07-18 03:26:38","2018-07-18 03:26:38"
266,"Silcoon was thought to endure hunger and not consume
anything before its evolution. However, it is now thought
that this Pokémon slakes its thirst by drinking rainwater
that collects on its silk.","2018-07-18 03:27:02","2018-07-18 03:27:02"
267,"Beautifly has a long mouth like a coiled needle, which is very
convenient for collecting pollen from flowers. This Pokémon
rides the spring winds as it flits around gathering pollen.","2018-07-18 03:51:24","2018-07-18 03:51:24"
268,"If it is attacked, Cascoon remains motionless however badly it
may be hurt. It does so because if it were to move, its body
would be weak upon evolution. This Pokémon will also not
forget the pain it endured.","2018-07-18 03:49:45","2018-07-18 03:49:45"
269,"When Dustox flaps its wings, a fine dust is scattered all over.
This dust is actually a powerful poison that will even make a
pro wrestler sick. This Pokémon searches for food using its
antennae like radar.","2018-07-18 03:49:20","2018-07-18 03:49:20"
270,"Lotad is said to have dwelled on land before. However, this
Pokémon is thought to have returned to water because the
leaf on its head grew large and heavy. It now lives by floating
atop the water.","2018-07-18 03:50:17","2018-07-18 03:50:17"
271,"Lombre’s entire body is covered by a slippery, slimy film.
It feels horribly unpleasant to be touched by this Pokémon’s
hands. Lombre is often mistaken for a human child.","2018-07-18 03:49:40","2018-07-18 03:49:40"
272,"Upon hearing an upbeat and cheerful rhythm, the cells in
Ludicolo’s body become very energetic and active. Even
in battle, this Pokémon will exhibit an amazing amount
of power.","2018-07-18 04:08:23","2018-07-18 04:08:23"
273,"Seedot looks exactly like an acorn when it is dangling from a
tree branch. It startles other Pokémon by suddenly moving.
This Pokémon polishes its body once a day using leaves.","2018-07-18 04:08:48","2018-07-18 04:08:48"
274,"This Pokémon pulls out the leaf on its head and makes a flute
with it. The sound of Nuzleaf’s flute strikes fear and uncertainty
in the hearts of people lost in a forest.","2018-07-18 03:16:22","2018-07-18 03:16:22"
275,"Shiftry’s large fans generate awesome gusts of wind at a
speed close to 100 feet per second. The whipped-up wind
blows anything away. This Pokémon chooses to live quietly
deep in forests.","2018-07-18 03:27:33","2018-07-18 03:27:33"
276,"Taillow is young—it has only just left its nest. As a result,
it sometimes becomes lonesome and cries at night.
This Pokémon feeds on Wurmple that live in forests.","2018-07-18 04:08:29","2018-07-18 04:08:29"
277,"Swellow is very conscientious about the upkeep of its glossy
wings. Once two Swellow are gathered, they diligently take
care of cleaning each other’s wings.","2018-07-18 03:49:41","2018-07-18 03:49:41"
278,"Fishermen keep an eye out for Wingull in the
sky, because wherever they’re circling, the
ocean is sure to be teeming with fish Pokémon.","2018-07-18 04:08:52","2018-07-18 04:08:52"
279,"Gathering food is the work of young males.
They store food in their capacious beaks and
carry it back to others waiting in the nest.","2018-07-18 03:51:30","2018-07-18 03:51:30"
280,"Ralts has the ability to sense the emotions of people. If its
Trainer is in a cheerful mood, this Pokémon grows cheerful
and joyous in the same way.","2018-07-18 03:14:46","2018-07-18 03:14:46"
281,"Kirlia uses the horns on its head to amplify its psychokinetic
power. When the Pokémon uses its power, the air around it
becomes distorted, creating mirages of nonexistent scenery.","2018-07-18 02:58:18","2018-07-18 02:58:18"
282,"Gardevoir has the psychokinetic power to distort the
dimensions and create a small black hole. This Pokémon
will try to protect its Trainer even at the risk of its own life.","2018-07-18 03:50:35","2018-07-18 03:50:35"
283,"When this Pokémon senses danger, a sweet
fluid oozes from the tip of its head. The taste
of it disgusts bird Pokémon.","2018-07-18 03:15:10","2018-07-18 03:15:10"
284,"Its wings and antennae don’t cope well with
moisture. After a rain, it faces sunward to
dry off.","2018-07-18 03:50:49","2018-07-18 03:50:49"
285,"If Shroomish senses danger, it shakes its body and scatters
spores from the top of its head. This Pokémon’s spores are
so toxic, they make trees and weeds wilt.","2018-07-18 04:08:54","2018-07-18 04:08:54"
286,"The seeds ringing Breloom’s tail are made of hardened toxic
spores. It is horrible to eat the seeds. Just taking a bite of this
Pokémon’s seed will cause your stomach to rumble.","2018-07-18 04:08:50","2018-07-18 04:08:50"
287,"Slakoth’s heart beats just once a minute. Whatever happens,
it is content to loaf around motionless. It is rare to see this
Pokémon in motion.","2018-07-18 03:02:11","2018-07-18 03:02:11"
288,"Vigoroth is simply incapable of remaining still. Even when it
tries to sleep, the blood in its veins grows agitated, compelling
this Pokémon to run wild throughout the jungle before it can
settle down.","2018-07-18 04:08:30","2018-07-18 04:08:30"
289,"Wherever Slaking live, rings of over a yard in diameter appear
in grassy fields. They are made by the Pokémon as it eats all
the grass within reach while lying prone on the ground.","2018-07-18 03:50:54","2018-07-18 03:50:54"
290,"Nincada lives underground. It uses its sharp claws to carve the
roots of trees and absorb moisture and nutrients.
This Pokémon can’t withstand bright sunlight so avoids it.","2018-07-18 04:08:50","2018-07-18 04:08:50"
291,"If Ninjask is not trained properly, it will refuse to obey
the Trainer and cry loudly continuously. Because of this
quality, this Pokémon is said to be one that puts the
Trainer’s abilities to the test.","2018-07-18 03:14:18","2018-07-18 03:14:18"
292,"Shedinja is a peculiar Pokémon. It seems to appear unsought
in a Poké Ball after a Nincada evolves. This bizarre Pokémon
is entirely immobile—it doesn’t even breathe.","2018-07-18 03:49:37","2018-07-18 03:49:37"
293,"Whismur is very timid. If it starts to cry loudly, it becomes
startled by its own crying and cries even harder. When it finally
stops crying, the Pokémon goes to sleep, all tired out.","2018-07-18 03:49:40","2018-07-18 03:49:40"
294,"Loudred shouts while stamping its feet. After it finishes
shouting, this Pokémon becomes incapable of hearing
anything for a while. This is considered to be a weak point.","2018-07-18 03:02:41","2018-07-18 03:02:41"
295,"Exploud communicates its feelings to the others by emitting
whistle-like sounds from the tubes on its body. This Pokémon
only raises its voice when it is in battle.","2018-07-18 04:08:28","2018-07-18 04:08:28"
296,"Their daily routine consists of training together
first thing in the morning, eating and napping in
the afternoon, and then more training afterward.","2018-07-18 03:27:20","2018-07-18 03:27:20"
297,"They love to compare their freakish strength—
strength enough to send a truck flying with a
single slap.","2018-07-18 03:14:03","2018-07-18 03:14:03"
298,"Azurill’s tail is large and bouncy. It is packed full of the
nutrients this Pokémon needs to grow. Azurill can be seen
bouncing and playing on its big, rubbery tail.","2018-07-18 04:11:06","2018-07-18 04:11:06"
299,"It uses powerful magnetism to drag its prey
toward it. It’s also been known to pull in metal,
which it collects and uses to protect itself.","2018-07-18 04:10:18","2018-07-18 04:10:18"
300,"Skitty is known to chase around playfully after its own tail.
In the wild, this Pokémon lives in holes in the trees of forests.
It is very popular as a pet because of its adorable looks.","2018-07-18 03:50:51","2018-07-18 03:50:51"
301,"Delcatty sleeps anywhere it wants without keeping a permanent
nest. If other Pokémon approach it as it sleeps, this Pokémon
will never fight—it will just move away somewhere else.","2018-07-18 04:10:19","2018-07-18 04:10:19"
302,"This Pokémon is feared. When its gemstone eyes
begin to glow with a sinister shine, it’s believed
that Sableye will steal people’s spirits away.","2018-07-18 03:26:37","2018-07-18 03:26:37"
303,"Don’t be taken in by this Pokémon’s cute face—it’s very
dangerous. Mawile fools the foe into letting down its guard,
then chomps down with its massive jaws. The steel jaws are
really horns that have been transformed.","2018-07-18 03:50:32","2018-07-18 03:50:32"
304,"Aron has a body of steel. With one all-out charge, this
Pokémon can demolish even a heavy dump truck.
The destroyed dump truck then becomes a handy meal
for the Pokémon.","2018-07-18 04:08:53","2018-07-18 04:08:53"
305,"Lairon feeds on iron contained in rocks and water. It makes
its nest on mountains where iron ore is buried. As a result,
the Pokémon often clashes with humans mining the iron ore.","2018-07-18 03:02:03","2018-07-18 03:02:03"
306,"Aggron is protective of its environment. If its mountain is
ravaged by a landslide or a fire, this Pokémon will haul
topsoil to the area, plant trees, and beautifully restore its
own territory.","2018-07-18 03:01:57","2018-07-18 03:01:57"
307,"Meditite heightens its inner energy through meditation.
It survives on just one berry a day. Minimal eating is another
aspect of this Pokémon’s training.","2018-07-18 03:51:04","2018-07-18 03:51:04"
308,"Through the power of meditation, Medicham developed its
sixth sense. It gained the ability to use psychokinetic powers.
This Pokémon is known to meditate for a whole month
without eating.","2018-07-18 03:27:45","2018-07-18 03:27:45"
309,"Electrike runs faster than the human eye can follow.
The friction from running is converted into electricity,
which is then stored in this Pokémon’s fur.","2018-07-18 03:27:03","2018-07-18 03:27:03"
310,"Manectric discharges strong electricity from its mane.
The mane is used for collecting electricity in the atmosphere.
This Pokémon creates thunderclouds above its head.","2018-07-18 04:11:03","2018-07-18 04:11:03"
311,"When Plusle is cheering on its partner, it flashes with electric
sparks from all over its body. If its partner loses, this Pokémon
cries loudly.","2018-07-18 04:11:03","2018-07-18 04:11:03"
312,"Minun loves to cheer on its partner in battle. It gives off sparks
from its body while it is doing so. If its partner is in trouble,
this Pokémon gives off increasing amounts of sparks.","2018-07-18 03:50:36","2018-07-18 03:50:36"
313,"Volbeat’s tail glows like a lightbulb. With other Volbeat,
it uses its tail to draw geometric shapes in the night sky.
This Pokémon loves the sweet aroma given off by Illumise.","2018-07-18 03:26:42","2018-07-18 03:26:42"
314,"Illumise leads a flight of illuminated Volbeat to draw signs in
the night sky. This Pokémon is said to earn greater respect
from its peers by composing more complex designs in the sky.","2018-07-18 03:02:00","2018-07-18 03:02:00"
315,"On extremely rare occasions, a Roselia is said to appear with
its flowers in unusual colors. The thorns on this Pokémon’s
head contain a vicious poison.","2018-07-18 03:02:09","2018-07-18 03:02:09"
316,"Most of Gulpin’s body is made up of its stomach—its heart and
brain are very small in comparison. This Pokémon’s stomach
contains special enzymes that dissolve anything.","2018-07-18 03:50:53","2018-07-18 03:50:53"
317,"Swalot has no teeth, so what it eats, it swallows whole, no
matter what. Its cavernous mouth yawns widely. An automobile
tire could easily fit inside this Pokémon’s mouth.","2018-07-18 03:26:51","2018-07-18 03:26:51"
318,"If they scent the faintest trace of blood, they
rush to attack en masse. When alone, they’re
rather cowardly.","2018-07-18 04:10:22","2018-07-18 04:10:22"
319,"It has a sad history. In the past, its dorsal fin
was a treasured foodstuff, so this Pokémon
became a victim of overfishing.","2018-07-18 03:49:59","2018-07-18 03:49:59"
320,"It shows off by spraying jets of seawater from
the nostrils above its eyes. It eats a solid ton of
Wishiwashi every day.","2018-07-18 03:27:15","2018-07-18 03:27:15"
321,"Its immense size is the reason for its popularity.
Wailord watching is a favorite sightseeing
activity in various parts of the world.","2018-07-18 04:08:39","2018-07-18 04:08:39"
322,"Numel stores magma of almost 2,200 degrees Fahrenheit
within its body. If it gets wet, the magma cools and hardens.
In that event, the Pokémon’s body grows heavy and its
movements become sluggish.","2018-07-18 04:11:11","2018-07-18 04:11:11"
323,"The humps on Camerupt’s back are formed by a transformation
of its bones. They sometimes blast out molten magma.
This Pokémon apparently erupts often when it is enraged.","2018-07-18 03:50:14","2018-07-18 03:50:14"
324,"If the fire burning within its shell goes out, it will
die. Those who wish to raise one in their home
must always keep something flammable at hand.","2018-07-18 03:01:53","2018-07-18 03:01:53"
325,"Spoink keeps a pearl on top of its head. The pearl functions to
amplify this Pokémon’s psychokinetic powers. It is therefore on
a constant search for a bigger pearl.","2018-07-18 03:49:48","2018-07-18 03:49:48"
326,"Grumpig uses the black pearls on its body to wield
its fantastic powers. When it is doing so, it dances bizarrely.
This Pokémon’s black pearls are valuable as works of art.","2018-07-18 03:02:09","2018-07-18 03:02:09"
327,"Each and every Spinda has a slightly different
configuration of spots. There are collectors who
enjoy the tiny differences in their spot patterns.","2018-07-18 04:11:01","2018-07-18 04:11:01"
328,"As it digs through the sand, its giant jaws
crush any rocks that obstruct its path. It builds
a funnel-shaped nest.","2018-07-18 04:11:16","2018-07-18 04:11:16"
329,"To help make its wings grow, it dissolves
quantities of prey in its digestive juices and
guzzles them down every day.","2018-07-18 03:16:16","2018-07-18 03:16:16"
330,"This Pokémon hides in the heart of sandstorms
it creates and seldom appears where people
can see it.","2018-07-18 02:57:39","2018-07-18 02:57:39"
331,"The more arid and harsh the environment, the more pretty and
fragrant a flower Cacnea grows. This Pokémon battles by
wildly swinging its thorny arms.","2018-07-18 02:57:41","2018-07-18 02:57:41"
332,"If a traveler is going through a desert in the thick of night,
Cacturne will follow in a ragtag group. The Pokémon are
biding their time, waiting for the traveler to tire and become
incapable of moving.","2018-07-18 03:15:42","2018-07-18 03:15:42"
333,"Swablu loves to make things clean. If it spots something dirty,
it will wipe and polish it with its cottony wings. If its wings
become dirty, this Pokémon finds a stream and showers itself.","2018-07-18 03:27:14","2018-07-18 03:27:14"
334,"Altaria sings in a gorgeous soprano. Its wings are like cotton
clouds. This Pokémon catches updrafts with its buoyant wings
and soars way up into the wild blue yonder.","2018-07-18 03:50:04","2018-07-18 03:50:04"
335,"Zangoose usually stays on all fours, but when angered, it gets
up on its hind legs and extends its claws. This Pokémon shares
a bitter rivalry with Seviper that dates back over generations.","2018-07-18 03:51:26","2018-07-18 03:51:26"
336,"Seviper’s swordlike tail serves two purposes—it slashes foes
and douses them with secreted poison. This Pokémon will not
give up its long-running blood feud with Zangoose.","2018-07-18 03:02:44","2018-07-18 03:02:44"
337,"Lunatone becomes active around the time of the full moon.
Instead of walking, it moves by floating in midair.
The Pokémon’s intimidating red eyes cause all those who
see it to become transfixed with fear.","2018-07-18 02:58:04","2018-07-18 02:58:04"
338,"Sunlight is the source of Solrock’s power. It is said to possess
the ability to read the emotions of others. This Pokémon gives
off intense heat while rotating its body.","2018-07-18 03:02:28","2018-07-18 03:02:28"
339,"Its slippery body is hard to grasp, so much so
that there are festivals where people compete
to see how many they can catch barehanded.","2018-07-18 03:01:51","2018-07-18 03:01:51"
340,"Sighting Whiscash leaping from the water
is believed to herald an earthquake.","2018-07-18 04:10:32","2018-07-18 04:10:32"
341,"Corphish catches prey with its sharp claws. It has no
likes or dislikes when it comes to food—it will eat anything.
This Pokémon has no trouble living in filthy water.","2018-07-18 02:57:49","2018-07-18 02:57:49"
342,"Crawdaunt molts (sheds) its shell regularly. Immediately after
molting, its shell is soft and tender. Until the shell hardens,
this Pokémon hides in its streambed burrow to avoid attack
from its foes.","2018-07-18 02:58:01","2018-07-18 02:58:01"
343,"As soon as it spots others of its kind, Baltoy congregates with
them and then begins crying noisily in unison. This Pokémon
sleeps while cleverly balancing itself on its one foot.","2018-07-18 02:58:01","2018-07-18 02:58:01"
344,"Claydol is an enigma that appeared from a clay statue made by
an ancient civilization dating back 20,000 years. This Pokémon
shoots beams from both its hands.","2018-07-18 04:10:21","2018-07-18 04:10:21"
345,"Lileep is an ancient Pokémon that was regenerated from a
fossil. It remains permanently anchored to a rock. From its
immobile perch, this Pokémon intently scans for prey with its
two eyes.","2018-07-18 04:08:47","2018-07-18 04:08:47"
346,"Cradily’s body serves as an anchor, preventing it from being
washed away in rough seas. This Pokémon secretes a strong
digestive fluid from its tentacles.","2018-07-18 04:10:14","2018-07-18 04:10:14"
347,"Anorith is said to be a type of Pokémon predecessor, with
eight wings at the sides of its body. This Pokémon swam in the
primordial sea by undulating these eight wings.","2018-07-18 03:16:06","2018-07-18 03:16:06"
348,"Armaldo is a Pokémon species that became extinct in
prehistoric times. This Pokémon is said to have walked
on its hind legs, which would have been more convenient
for life on land.","2018-07-18 03:16:01","2018-07-18 03:16:01"
349,"Although unattractive and unpopular, this
Pokémon’s marvelous vitality has made it a
subject of research.","2018-07-18 03:02:13","2018-07-18 03:02:13"
350,"It lives at the bottom of clear lakes. In times of
war, it shows itself, which soothes people’s
minds and hearts.","2018-07-18 03:50:45","2018-07-18 03:50:45"
351,"Its form changes on its own, due to its cells’
sensitive reactions to temperature and humidity.","2018-07-18 03:15:54","2018-07-18 03:15:54"
352,"Kecleon alters its body coloration to blend in with its
surroundings, allowing it to sneak up on its prey unnoticed.
Then it lashes out with its long, stretchy tongue to instantly
ensnare the unsuspecting target.","2018-07-18 03:51:13","2018-07-18 03:51:13"
353,"Shuppet grows by feeding on dark emotions, such as
vengefulness and envy, in the hearts of people. It roams
through cities in search of grudges that taint people.","2018-07-18 03:51:21","2018-07-18 03:51:21"
354,"A cursed energy permeated the stuffing of a discarded and
forgotten plush doll, giving it new life as Banette.
The Pokémon’s energy would escape if it were to ever open
its mouth.","2018-07-18 04:08:39","2018-07-18 04:08:39"
355,"Duskull wanders lost among the deep darkness of midnight.
There is an oft-told admonishment given to misbehaving
children that this Pokémon will spirit away bad children who
earn scoldings from their mothers.","2018-07-18 02:58:30","2018-07-18 02:58:30"
356,"Dusclops absorbs anything, however large the object may be.
This Pokémon hypnotizes its foe by waving its hands in a
macabre manner and by bringing its single eye to bear.
The hypnotized foe is made to do Dusclops’s bidding.","2018-07-18 03:02:47","2018-07-18 03:02:47"
357,"Children of the southern tropics eat as snacks the fruit that
grows in bunches around the neck of Tropius. This Pokémon
flies by flapping the leaves on its back as if they were wings.","2018-07-18 03:02:27","2018-07-18 03:02:27"
358,"In high winds, Chimecho cries as it hangs from a tree branch or
the eaves of a building using a suction cup on its head. This
Pokémon plucks berries with its long tail and eats them.","2018-07-18 04:08:41","2018-07-18 04:08:41"
359,"Although it’s said to bring disaster, in actuality,
this Pokémon possesses a calm disposition and
warns people of any crises that loom.","2018-07-18 03:50:31","2018-07-18 03:50:31"
360,"Wynaut gather on moonlit nights to play by squeezing up
against each other. By being squeezed, this Pokémon gains
endurance and is trained to dole out powerful counterattacks.","2018-07-18 03:26:41","2018-07-18 03:26:41"
361,"It can only survive in cold areas. It bounces
happily around, even in environments as cold as
-150 degrees Fahrenheit.","2018-07-18 02:58:05","2018-07-18 02:58:05"
362,"Its prey is instantaneously frozen stiff by the
cold air it exhales from its huge mouth. While
they’re in that frozen state, it gobbles them up.","2018-07-18 04:08:44","2018-07-18 04:08:44"
363,"Spheal always travels by rolling around on its ball-like body.
When the season for ice floes arrives, this Pokémon can be
seen rolling about on ice and crossing the sea.","2018-07-18 03:50:57","2018-07-18 03:50:57"
364,"Sealeo often balances and rolls things on the tip of its
nose. While the Pokémon is rolling something, it checks
the object’s aroma and texture to determine whether it likes
the object or not.","2018-07-18 03:50:46","2018-07-18 03:50:46"
365,"Walrein swims all over in frigid seawater while crushing
icebergs with its grand, imposing tusks. Its thick layer of
blubber makes enemy attacks bounce off harmlessly.","2018-07-18 04:08:49","2018-07-18 04:08:49"
366,"Clamperl grows while being protected by its rock-hard shell.
When its body becomes too large to fit inside the shell, it is
sure evidence that this Pokémon is getting close to evolution.","2018-07-18 04:08:18","2018-07-18 04:08:18"
367,"Huntail’s tail is shaped like a fish. It uses the tail to attract
prey, then swallows the prey whole with its large, gaping
mouth. This Pokémon swims by wiggling its slender body
like a snake.","2018-07-18 03:49:51","2018-07-18 03:49:51"
368,"Although Gorebyss is the very picture of elegance and beauty
while swimming, it is also cruel. When it spots prey, this
Pokémon inserts its thin mouth into the prey’s body and drains
the prey of its body fluids.","2018-07-18 03:14:23","2018-07-18 03:14:23"
369,"It was fortuitously discovered during a deep sea
expedition. Its teeth have atrophied, so it now
survives on microscopic organisms it sucks up.","2018-07-18 04:11:06","2018-07-18 04:11:06"
370,"Loving couples have a soft spot for this
Pokémon, so honeymoon hotels often release
this Pokémon into their pools.","2018-07-18 03:16:09","2018-07-18 03:16:09"
371,"With its steel-hard stone head, it headbutts
indiscriminately. This is because of the stress
it feels at being unable to fly.","2018-07-18 03:15:59","2018-07-18 03:15:59"
