number,description,createdAt,updatedAt
130,"There are people who swear that any place
Gyarados appears is fated for destruction.","2018-07-18 03:14:08","2018-07-18 03:14:08"
131,"These Pokémon were once near extinction due
to poaching. Following protective regulations,
there is now an overabundance of them.","2018-07-18 03:51:36","2018-07-18 03:51:36"
132,"With its astonishing capacity for
metamorphosis, it can get along with anything.
It does not get along well with its fellow Ditto.","2018-07-18 03:14:55","2018-07-18 03:14:55"
133,"Current studies show it can evolve into an
incredible eight different species of Pokémon.","2018-07-18 03:15:57","2018-07-18 03:15:57"
134,"Blending in with the water and erasing all signs
of its presence, it patiently waits for its prey,
fish Pokémon.","2018-07-18 03:50:56","2018-07-18 03:50:56"
135,"When its fur stands on end, that’s a sign it’s
about to give off a jolt of electricity. Take care,
as sometimes lightning strikes next to it, too.","2018-07-18 03:15:13","2018-07-18 03:15:13"
136,"Its average body temperature is between 1,300
and 1,500 degrees Fahrenheit. In its internal
flame sac, temperatures reach 3,000 degrees.","2018-07-18 04:08:35","2018-07-18 04:08:35"
137,"It can convert its body into digital data,
which enables it to enter cyberspace.","2018-07-18 03:14:40","2018-07-18 03:14:40"
138,"Omanyte is one of the ancient and long-since-extinct Pokémon
that have been regenerated from fossils by people. If attacked
by an enemy, it withdraws itself inside its hard shell.","2018-07-18 03:16:00","2018-07-18 03:16:00"
139,"Omastar uses its tentacles to capture its prey. It is
believed to have become extinct because its shell grew too
large and heavy, causing its movements to become too slow
and ponderous.","2018-07-18 03:51:03","2018-07-18 03:51:03"
140,"Kabuto is a Pokémon that has been regenerated from a fossil.
However, in extremely rare cases, living examples have
been discovered. The Pokémon has not changed at all for
300 million years.","2018-07-18 03:14:26","2018-07-18 03:14:26"
141,"Kabutops swam underwater to hunt for its prey in ancient
times. The Pokémon was apparently evolving from being a
water dweller to living on land as evident from the beginnings
of change in its gills and legs.","2018-07-18 04:08:06","2018-07-18 04:08:06"
142,"In ancient times, it ruled the skies. A widely
accepted theory is that it went extinct due to
a large meteor impact.","2018-07-18 03:15:07","2018-07-18 03:15:07"
143,"It eats nearly 900 pounds of food every day.
It starts nodding off while eating—and continues
to eat even while it’s asleep.","2018-07-18 03:14:22","2018-07-18 03:14:22"
144,"Articuno is a legendary bird Pokémon that can control ice.
The flapping of its wings chills the air. As a result, it is said
that when this Pokémon flies, snow will fall.","2018-07-18 03:15:21","2018-07-18 03:15:21"
145,"Zapdos is a legendary bird Pokémon that has the ability
to control electricity. It usually lives in thunderclouds.
The Pokémon gains power if it is stricken by lightning bolts.","2018-07-18 03:02:31","2018-07-18 03:02:31"
146,"Moltres is a legendary bird Pokémon that has the ability
to control fire. If this Pokémon is injured, it is said to dip its
body in the molten magma of a volcano to burn and heal itself.","2018-07-18 03:27:06","2018-07-18 03:27:06"
147,"After a 10-hour struggle, a fisherman was able
to pull one up and confirm its existence.","2018-07-18 03:14:24","2018-07-18 03:14:24"
148,"From time immemorial, it has been venerated by
agricultural peoples as an entity able to control
the weather.","2018-07-18 03:26:40","2018-07-18 03:26:40"
149,"Incur the wrath of this normally calm Pokémon
at your peril, because it will smash everything
to smithereens before it’s satisfied.","2018-07-18 03:14:21","2018-07-18 03:14:21"
150,"Mewtwo is a Pokémon that was created by genetic
manipulation. However, even though the scientific power
of humans created this Pokémon’s body, they failed to
endow Mewtwo with a compassionate heart.","2018-07-18 03:15:04","2018-07-18 03:15:04"
151,"Mew is said to possess the genetic composition of all
Pokémon. It is capable of making itself invisible at will,
so it entirely avoids notice even if it approaches people.","2018-07-18 03:26:49","2018-07-18 03:26:49"
152,"In battle, Chikorita waves its leaf around to keep the foe at
bay. However, a sweet fragrance also wafts from the leaf,
becalming the battling Pokémon and creating a cozy,
friendly atmosphere all around.","2018-07-18 03:15:23","2018-07-18 03:15:23"
153,"Bayleef’s neck is ringed by curled-up leaves. Inside each
tubular leaf is a small shoot of a tree. The fragrance of this
shoot makes people peppy.","2018-07-18 03:50:43","2018-07-18 03:50:43"
154,"The fragrance of Meganium’s flower soothes and calms
emotions. In battle, this Pokémon gives off more of its
becalming scent to blunt the foe’s fighting spirit.","2018-07-18 04:08:28","2018-07-18 04:08:28"
155,"Cyndaquil protects itself by flaring up the flames on its back.
The flames are vigorous if the Pokémon is angry. However, if it
is tired, the flames splutter fitfully with incomplete combustion.","2018-07-18 03:50:48","2018-07-18 03:50:48"
156,"Quilava keeps its foes at bay with the intensity of its flames
and gusts of superheated air. This Pokémon applies its
outstanding nimbleness to dodge attacks even while scorching
the foe with flames.","2018-07-18 03:50:33","2018-07-18 03:50:33"
157,"Typhlosion obscures itself behind a shimmering heat haze that
it creates using its intensely hot flames. This Pokémon creates
blazing explosive blasts that burn everything to cinders.","2018-07-18 04:08:23","2018-07-18 04:08:23"
158,"Despite the smallness of its body, Totodile’s jaws are very
powerful. While the Pokémon may think it is just playfully
nipping, its bite has enough power to cause serious injury.","2018-07-18 03:26:39","2018-07-18 03:26:39"
159,"Once Croconaw has clamped its jaws on its foe, it will
absolutely not let go. Because the tips of its fangs are
forked back like barbed fishhooks, they become impossible
to remove when they have sunk in.","2018-07-18 03:51:11","2018-07-18 03:51:11"
160,"Feraligatr intimidates its foes by opening its huge mouth.
In battle, it will kick the ground hard with its thick and powerful
hind legs to charge at the foe at an incredible speed.","2018-07-18 03:26:57","2018-07-18 03:26:57"
161,"When Sentret sleeps, it does so while another stands guard.
The sentry wakes the others at the first sign of danger. When
this Pokémon becomes separated from its pack, it becomes
incapable of sleep due to fear.","2018-07-18 03:14:47","2018-07-18 03:14:47"
162,"Furret has a very slim build. When under attack, it can slickly
squirm through narrow spaces and get away. In spite of its
short limbs, this Pokémon is very nimble and fleet.","2018-07-18 03:14:52","2018-07-18 03:14:52"
163,"Hoothoot has an internal organ that senses and tracks the
earth’s rotation. Using this special organ, this Pokémon
begins hooting at precisely the same time every day.","2018-07-18 03:13:49","2018-07-18 03:13:49"
164,"Noctowl never fails at catching prey in darkness. This Pokémon
owes its success to its superior vision that allows it to see in
minimal light, and to its soft, supple wings that make no sound
in flight.","2018-07-18 03:13:51","2018-07-18 03:13:51"
165,"They communicate with one another using bodily
fluids that give off odors. When they’re angry,
their odor smells sour.","2018-07-18 03:14:16","2018-07-18 03:14:16"
166,"In battle, it throws punches with all four arms.
The power of each individual blow is piddly,
so it aims to win by quantity rather than quality.","2018-07-18 03:13:55","2018-07-18 03:13:55"
167,"Some fishermen weave its sturdy thread into
nets to catch fish Pokémon.","2018-07-18 02:57:16","2018-07-18 02:57:16"
168,"It spins thread from both its rear and its mouth.
Then it wraps its prey up in thread and sips
their bodily fluids at its leisure.","2018-07-18 02:58:10","2018-07-18 02:58:10"
169,"Silent and swift in its four-winged flight, it bites
down on its prey before they realize what’s
happening. In a heartbeat, it drains their blood.","2018-07-18 03:13:52","2018-07-18 03:13:52"
170,"It lives in the depths beyond the reach of
sunlight. It flashes lights on its antennae
to communicate with others of its kind.","2018-07-18 03:28:22","2018-07-18 03:28:22"
171,"This Pokémon flashes a bright light that blinds
its prey. This creates an opening for it to deliver
an electrical attack.","2018-07-18 03:16:22","2018-07-18 03:16:22"
172,"Despite this Pokémon’s cute appearance, those
who want to live with one should prepare to be
on the receiving end of its electric jolts.","2018-07-18 04:08:31","2018-07-18 04:08:31"
173,"Because of its silhouette, it’s believed to be a
star reborn. For some reason, it loves Minior.","2018-07-18 03:14:40","2018-07-18 03:14:40"
174,"It moves by bouncing along. As it moves a lot,
it sweats, and its body gives off a sweet aroma.","2018-07-18 03:14:56","2018-07-18 03:14:56"
175,"As its energy, Togepi uses the positive emotions of
compassion and pleasure exuded by people and Pokémon.
This Pokémon stores up feelings of happiness inside its shell,
then shares them with others.","2018-07-18 03:01:52","2018-07-18 03:01:52"
176,"Togetic is said to be a Pokémon that brings good fortune.
When the Pokémon spots someone who is pure of heart,
it is said to appear and share its happiness with that person.","2018-07-18 03:27:26","2018-07-18 03:27:26"
177,"Natu has a highly developed jumping ability. The Pokémon
flaps and leaps onto tree branches that are taller than
grown-up people to pick at the tree’s new shoots.","2018-07-18 04:08:24","2018-07-18 04:08:24"
178,"Xatu is known to stand motionless while staring at the sun all
day long. Some people revere it as a mystical Pokémon out of
their belief that Xatu is in possession of the power to see into
the future.","2018-07-18 03:14:07","2018-07-18 03:14:07"
179,"Mareep’s fluffy coat of wool rubs together and builds a static
charge. The more static electricity is charged, the more brightly
the lightbulb at the tip of its tail glows.","2018-07-18 04:08:09","2018-07-18 04:08:09"
180,"Flaaffy’s wool quality changes so that it can generate
a high amount of static electricity with a small amount of
wool. The bare and slick parts of its hide are shielded
against electricity.","2018-07-18 04:08:31","2018-07-18 04:08:31"
181,"Ampharos gives off so much light that it can be seen even from
space. People in the old days used the light of this Pokémon
to send signals back and forth with others far away.","2018-07-18 03:14:15","2018-07-18 03:14:15"
182,"A Bellossom grows flowers more beautifully if it has evolved
from a smelly Gloom—the more stinky the better. At night, this
Pokémon closes its petals and goes to sleep.","2018-07-18 04:08:10","2018-07-18 04:08:10"
183,"When fishing for food at the edge of a fast-running stream,
Marill wraps its tail around the trunk of a tree. This Pokémon’s
tail is flexible and configured to stretch.","2018-07-18 03:50:40","2018-07-18 03:50:40"
184,"Azumarill can make balloons out of air. It makes these air
balloons if it spots a drowning Pokémon. The air balloons
enable the Pokémon in trouble to breathe.","2018-07-18 03:14:57","2018-07-18 03:14:57"
185,"Apparently, the larger the green parts of this
Pokémon, the more collectors value it. It’s a
particular favorite among elderly people.","2018-07-18 03:51:22","2018-07-18 03:51:22"
186,"It’s the leader of Poliwag and Poliwhirl.
When Politoed roars, they all cower in fear.","2018-07-18 03:02:03","2018-07-18 03:02:03"
187,"This Pokémon drifts and floats with the wind. If it senses the
approach of strong winds, Hoppip links its leaves with other
Hoppip to prepare against being blown away.","2018-07-18 02:57:49","2018-07-18 02:57:49"
188,"Skiploom’s flower blossoms when the temperature rises
above 64 degrees Fahrenheit. How much the flower opens
depends on the temperature. For that reason, this Pokémon
is sometimes used as a thermometer.","2018-07-18 03:14:42","2018-07-18 03:14:42"
189,"Jumpluff rides warm southern winds to cross the sea and fly to
foreign lands. The Pokémon descends to the ground when it
encounters cold air while it is floating.","2018-07-18 04:08:32","2018-07-18 04:08:32"
190,"Aipom’s tail ends in a hand-like appendage that can be cleverly
manipulated. However, because the Pokémon uses its tail so
much, its real hands have become rather clumsy.","2018-07-18 03:49:52","2018-07-18 03:49:52"
191,"Sunkern tries to move as little as it possibly can. It does so
because it tries to conserve all the nutrients it has stored in its
body for its evolution. It will not eat a thing, subsisting only on
morning dew.","2018-07-18 03:13:51","2018-07-18 03:13:51"
192,"Sunflora converts solar energy into nutrition. It moves around
actively in the daytime when it is warm. It stops moving as
soon as the sun goes down for the night.","2018-07-18 03:15:14","2018-07-18 03:15:14"
193,"Yanma is capable of seeing 360 degrees without having to
move its eyes. It is a great flier that is adept at making sudden
stops and turning midair. This Pokémon uses its flying ability
to quickly chase down targeted prey.","2018-07-18 04:08:13","2018-07-18 04:08:13"
194,"Wooper usually lives in water. However, it occasionally comes
out onto land in search of food. On land, it coats its body with
a gooey, toxic film.","2018-07-18 03:15:01","2018-07-18 03:15:01"
195,"Quagsire hunts for food by leaving its mouth wide open in
water and waiting for its prey to blunder in unaware. Because
the Pokémon does not move, it does not get very hungry.","2018-07-18 03:27:30","2018-07-18 03:27:30"
196,"It unleashes psychic power from the orb on its
forehead. When its power is exhausted, the orb
grows dull and dark.","2018-07-18 03:13:49","2018-07-18 03:13:49"
197,"With its black fur, it blends into the darkness.
It bides its time, and when prey appears, this
Pokémon goes for its throat, and then eats it.","2018-07-18 03:51:10","2018-07-18 03:51:10"
198,"Seen as a symbol of bad luck, it’s generally
disliked. Yet it gives presents—objects that
sparkle or shine—to Trainers it’s close to.","2018-07-18 03:16:02","2018-07-18 03:16:02"
199,"This Pokémon is so famed for its intellect that a
proverb still persists in some regions: “When in
doubt, ask Slowking.”","2018-07-18 02:57:51","2018-07-18 02:57:51"
200,"If you hear a sobbing sound emanating from a
vacant room, it’s undoubtedly a bit of mischief
from Misdreavus.","2018-07-18 04:08:40","2018-07-18 04:08:40"
201,"This Pokémon is shaped like ancient writing. It is a mystery as
to which came first, the ancient writings or the various Unown.
Research into this topic is ongoing but nothing is known.","2018-07-18 03:15:21","2018-07-18 03:15:21"
202,"Wobbuffet does nothing but endure attacks—it won’t attack on
its own. However, it won’t endure an attack on its tail. When
that happens, the Pokémon will try to take the foe with it using
Destiny Bond.","2018-07-18 03:14:25","2018-07-18 03:14:25"
203,"Girafarig’s rear head contains a tiny brain that is too small for
thinking. However, the rear head doesn’t need to sleep, so it
can keep watch over its surroundings 24 hours a day.","2018-07-18 03:02:07","2018-07-18 03:02:07"
204,"Pineco hangs from a tree branch and patiently waits for prey to
come along. If the Pokémon is disturbed while eating by
someone shaking its tree, it drops down to the ground and
explodes with no warning.","2018-07-18 02:58:22","2018-07-18 02:58:22"
205,"Forretress conceals itself inside its hardened steel shell.
The shell is opened when the Pokémon is catching prey,
but it does so at such a quick pace that the shell’s inside
cannot be seen.","2018-07-18 03:27:27","2018-07-18 03:27:27"
206,"Dunsparce has a drill for its tail. It uses this tail to burrow into
the ground backward. This Pokémon is known to make its
nest in complex shapes deep under the ground.","2018-07-18 03:26:56","2018-07-18 03:26:56"
207,"Gligar glides through the air without a sound as if it were
sliding. This Pokémon hangs on to the face of its foe using
its clawed hind legs and the large pincers on its forelegs, then
injects the prey with its poison barb.","2018-07-18 03:14:09","2018-07-18 03:14:09"
208,"Steelix lives even further underground than Onix.
This Pokémon is known to dig toward the earth’s core.
There are records of this Pokémon reaching a depth of
over six-tenths of a mile underground.","2018-07-18 03:26:47","2018-07-18 03:26:47"
209,"Its growls make its opponents uneasy. This
laid-back Pokémon tends to sleep half the day.","2018-07-18 03:50:58","2018-07-18 03:50:58"
210,"More timid than Snubbull, this Pokémon is doted
on by young people amused at the contrast
between its looks and its attitude.","2018-07-18 02:57:17","2018-07-18 02:57:17"
211,"Qwilfish sucks in water, inflating itself. This Pokémon
uses the pressure of the water it swallowed to shoot toxic
quills all at once from all over its body. It finds swimming
somewhat challenging.","2018-07-18 04:08:12","2018-07-18 04:08:12"
212,"Once it has identified an enemy, this Pokémon
smashes it mercilessly with pincers hard
as steel.","2018-07-18 04:07:57","2018-07-18 04:07:57"
213,"Shuckle quietly hides itself under rocks, keeping its body
concealed inside its hard shell while eating berries it has
stored away. The berries mix with its body fluids to become
a juice.","2018-07-18 03:51:01","2018-07-18 03:51:01"
214,"Heracross has sharp claws on its feet. These are planted
firmly into the ground or the bark of a tree, giving the
Pokémon a secure and solid footing to forcefully fling away
foes with its proud horn.","2018-07-18 03:01:54","2018-07-18 03:01:54"
215,"It uses its claws to poke holes in eggs so it can
slurp out the insides. Breeders consider it a
scourge and will drive it away or eradicate it.","2018-07-18 03:27:51","2018-07-18 03:27:51"
216,"This Pokémon likes to lick its palms that are sweetened by
being soaked in honey. Teddiursa concocts its own honey
by blending fruits and pollen collected by Beedrill.","2018-07-18 04:08:34","2018-07-18 04:08:34"
217,"In the forests inhabited by Ursaring, it is said that there are
many streams and towering trees where they gather food. This
Pokémon walks through its forest gathering food every day.","2018-07-18 04:08:26","2018-07-18 04:08:26"
218,"Slugma does not have any blood in its body. Instead, intensely
hot magma circulates throughout this Pokémon’s body,
carrying essential nutrients and oxygen to its organs.","2018-07-18 04:08:33","2018-07-18 04:08:33"
219,"Magcargo’s body temperature is approximately
18,000 degrees Fahrenheit. Water is vaporized on contact.
If this Pokémon is caught in the rain, the raindrops instantly
turn into steam, cloaking the area in a thick fog.","2018-07-18 03:27:46","2018-07-18 03:27:46"
220,"Swinub roots for food by rubbing its snout against the ground.
Its favorite food is a mushroom that grows under the cover of
dead grass. This Pokémon occasionally roots out hot springs.","2018-07-18 04:08:25","2018-07-18 04:08:25"
221,"Piloswine is covered by a thick coat of long hair that enables
it to endure the freezing cold. This Pokémon uses its tusks to
dig up food that has been buried under ice.","2018-07-18 04:08:16","2018-07-18 04:08:16"
222,"Pursued by Mareanie for the branches on its
head, this Pokémon will sometimes snap its own
branches off as a diversion while it escapes.","2018-07-18 04:08:15","2018-07-18 04:08:15"
223,"Remoraid sucks in water, then expels it at high velocity using
its abdominal muscles to shoot down flying prey. When
evolution draws near, this Pokémon travels downstream
from rivers.","2018-07-18 03:50:08","2018-07-18 03:50:08"
224,"Octillery grabs onto its foe using its tentacles. This Pokémon
tries to immobilize it before delivering the finishing blow. If the
foe turns out to be too strong, Octillery spews ink to escape.","2018-07-18 04:08:13","2018-07-18 04:08:13"
225,"It has a generous habit of sharing its food with
people and Pokémon, so it’s always scrounging
around for more food.","2018-07-18 03:51:17","2018-07-18 03:51:17"
226,"On sunny days, schools of Mantine can be seen elegantly
leaping over the sea’s waves. This Pokémon is not bothered
by the Remoraid that hitches rides.","2018-07-18 03:51:23","2018-07-18 03:51:23"
227,"Its metal body is sturdy, but it does rust rather
easily. So on rainy days, this Pokémon prefers
to stay put in its nest.","2018-07-18 04:08:18","2018-07-18 04:08:18"
228,"Houndour hunt as a coordinated pack. They communicate
with each other using a variety of cries to corner their prey.
This Pokémon’s remarkable teamwork is unparalleled.","2018-07-18 04:08:43","2018-07-18 04:08:43"
229,"In a Houndoom pack, the one with its horns raked sharply
toward the back serves a leadership role. These Pokémon
choose their leader by fighting among themselves.","2018-07-18 04:08:37","2018-07-18 04:08:37"
230,"Kingdra sleeps on the seafloor where it is otherwise devoid
of life. When a storm arrives, the Pokémon is said to awaken
and wander about in search of prey.","2018-07-18 04:08:35","2018-07-18 04:08:35"
231,"Phanpy uses its long nose to shower itself. When others
gather around, they thoroughly douse each other with water.
These Pokémon can be seen drying their soaking-wet
bodies at the edge of water.","2018-07-18 03:27:06","2018-07-18 03:27:06"
232,"If Donphan were to tackle with its hard body, even a house
could be destroyed. Using its massive strength, the Pokémon
helps clear rock and mud slides that block mountain trails.","2018-07-18 03:27:35","2018-07-18 03:27:35"
233,"Porygon was updated to a new version in
readiness for planetary development. But that
dream remains unrealized as yet.","2018-07-18 04:08:37","2018-07-18 04:08:37"
234,"Stantler’s magnificent antlers were traded at high prices as
works of art. As a result, this Pokémon was hunted close to
extinction by those who were after the priceless antlers.","2018-07-18 04:08:21","2018-07-18 04:08:21"
235,"It draws symbols all over the place to mark its
territory. In towns with many Smeargle, the walls
are covered in graffiti.","2018-07-18 03:50:33","2018-07-18 03:50:33"
236,"Tyrogue becomes stressed out if it does not get to train every
day. When raising this Pokémon, the Trainer must establish
and uphold various training methods.","2018-07-18 03:50:46","2018-07-18 03:50:46"
237,"Hitmontop spins on its head at high speed, all the while
delivering kicks. This technique is a remarkable mix of both
offense and defense at the same time. The Pokémon travels
faster spinning than it does walking.","2018-07-18 04:08:42","2018-07-18 04:08:42"
238,"Smoochum actively runs about, but also falls quite often.
Whenever the chance arrives, it will look for its reflection to
make sure its face hasn’t become dirty.","2018-07-18 03:51:18","2018-07-18 03:51:18"
239,"This Pokémon is constantly fighting with
Togedemaru that try to steal its electricity.
It’s a pretty even match.","2018-07-18 03:15:41","2018-07-18 03:15:41"
240,"A famous potter lives with a Magby.
Apparently its soft flames produce fine works.","2018-07-18 03:27:24","2018-07-18 03:27:24"
241,"Most people raise it for its milk, but it’s quite
tough and strong, so it’s also well suited
for battle.","2018-07-18 03:51:02","2018-07-18 03:51:02"
242,"Its fluffy fur coat acts as a sensor, enabling it to
read the feelings of people and Pokémon.","2018-07-18 04:08:46","2018-07-18 04:08:46"
243,"Raikou embodies the speed of lightning. The roars of
this Pokémon send shock waves shuddering through the
air and shake the ground as if lightning bolts had come
crashing down.","2018-07-18 04:08:22","2018-07-18 04:08:22"
244,"Entei embodies the passion of magma. This Pokémon is
thought to have been born in the eruption of a volcano.
It sends up massive bursts of fire that utterly consume all
that they touch.","2018-07-18 03:51:25","2018-07-18 03:51:25"
245,"Suicune embodies the compassion of a pure spring of water.
It runs across the land with gracefulness. This Pokémon has
the power to purify dirty water.","2018-07-18 03:50:42","2018-07-18 03:50:42"
246,"Larvitar is born deep under the ground. To come up to the
surface, this Pokémon must eat its way through the soil above.
Until it does so, Larvitar cannot see its parents.","2018-07-18 03:27:04","2018-07-18 03:27:04"
247,"Pupitar creates a gas inside its body that it compresses and
forcefully ejects to propel itself like a jet. The body is very
durable—it avoids damage even if it hits solid steel.","2018-07-18 03:15:55","2018-07-18 03:15:55"
248,"Tyranitar is so overwhelmingly powerful, it can bring down a
whole mountain to make its nest. This Pokémon wanders about
in mountains seeking new opponents to fight.","2018-07-18 03:03:18","2018-07-18 03:03:18"
249,"Lugia’s wings pack devastating power—a light fluttering of its
wings can blow apart regular houses. As a result, this
Pokémon chooses to live out of sight deep under the sea.","2018-07-18 04:08:27","2018-07-18 04:08:27"
250,"Ho-Oh’s feathers glow in seven colors depending on the angle
at which they are struck by light. These feathers are said to
bring happiness to the bearers. This Pokémon is said to live at
the foot of a rainbow.","2018-07-18 03:15:43","2018-07-18 03:15:43"
251,"This Pokémon came from the future by crossing over time.
It is thought that so long as Celebi appears, a bright and
shining future awaits us.","2018-07-18 03:50:00","2018-07-18 03:50:00"
252,"Treecko is cool, calm, and collected—it never panics under
any situation. If a bigger foe were to glare at this Pokémon,
it would glare right back without conceding an inch of ground.","2018-07-18 03:15:57","2018-07-18 03:15:57"
